{
  "$schema": "https://docs.runlater.io/agent/pricing-status.v1.schema.json",
  "version": "1.1.0",
  "status": "free_beta_only",
  "trial_duration": "P7D",
  "trial_task_allowance": 16,
  "credit_price": null,
  "currency": null,
  "payment_methods": [],
  "automatic_top_up": false,
  "live_purchases_enabled": false,
  "description": "Free beta only: seven-day identity/grant, 100 leased-attempt credits, five units reserved per fresh task and a 16-task lifetime cap. Attempt credits are not money. No purchases or automatic top-up. Check live registration capacity and the release window.",
  "trial_attempt_units": 100,
  "units_reserved_per_task": 5,
  "lifetime_project_capacity": 10
}
